{"$schema":"https://json-schema.org/draft/2020-12/schema","$id":"https://neuroai-workbench.example/schemas/entity-identifier-1.0.json","type":"object","required":["identifier_id","entity_id","scheme","value","status","registered_at","boundary"],"additionalProperties":false,"properties":{"identifier_id":{"type":"string","minLength":1},"entity_id":{"type":"string","minLength":1},"scheme":{"enum":["DOMAIN","LEI","ORCID","TRIAL_ID","PATENT","REGISTRY_ID","CUSTOM"]},"value":{"type":"string","minLength":1},"status":{"enum":["ACTIVE","SUPERSEDED","WITHDRAWN"]},"registered_at":{"type":"string","minLength":1},"jurisdiction":{"type":["string","null"]},"evidence_ref":{"type":["string","null"]},"predecessor_identifier_id":{"type":["string","null"]},"boundary":{"type":"string","minLength":1}}}
